"URUN_NO","LINK_AD","SPOR_DALI","MARKA","FIYAT","TUM_YILDIZ","YORUM_YILDIZ","YORUM_KULLANIM_SURESI","YORUM","YORUMUN_POLARITESI"
"14","https://www.decathlon.com.tr/r/kadin-outdoor-bot-gri-nh100/_/R-p-171860?mc=8649282&c=KAHVERENG%C4%B0_GR%C4%B0","outdoor_sporlar","Quechua","1590","4.5","5","Kullanılan süre 1 hafta ya da daha az tarihinden beri","Ürünü beğendim.",""
"14","https://www.decathlon.com.tr/r/kadin-outdoor-bot-gri-nh100/_/R-p-171860?mc=8649282&c=KAHVERENG%C4%B0_GR%C4%B0","outdoor_sporlar","Quechua","1590","4.5","4","Kullanılan süre 1 hafta ya da daha az tarihinden beri","Ayakkabı alımında 38 dar geliyo 39 numara da biraz büyük kalıyordu. Bu botta onu yaşamadım 39 numarasını aldım. Ama ayakkabının ön kısmı biraz dar olduğundan ayak parmaklarımı biraz rahatsız etti. Umarım biraz daha giymeyle biraz açılır. Onun haricinde güzel rahat bir bot.",""
"14","https://www.decathlon.com.tr/r/kadin-outdoor-bot-gri-nh100/_/R-p-171860?mc=8649282&c=KAHVERENG%C4%B0_GR%C4%B0","outdoor_sporlar","Quechua","1590","4.5","4","Kullanılan süre 3 ile 6 ay arası tarihinden beri","Tam bir fiyat performans botu, günlük ve doğa yürüyüşlerinde tercih ediyorum, ama çok soğuk karlı havalarda yetersiz geliyor ayağı üşütebiliyor, bir beden büyük alınması gerekir, aldığımda bilek kısmı biraz sıkı gibi gelmişti bağcıkları ile dengeledim",""
"14","https://www.decathlon.com.tr/r/kadin-outdoor-bot-gri-nh100/_/R-p-171860?mc=8649282&c=KAHVERENG%C4%B0_GR%C4%B0","outdoor_sporlar","Quechua","1590","4.5","5","Kullanılan süre 2 ile 8 hafta arası tarihinden beri","Soğuğa dayanıklı kayman taban yapısı şık ve sağlam",""
"14","https://www.decathlon.com.tr/r/kadin-outdoor-bot-gri-nh100/_/R-p-171860?mc=8649282&c=KAHVERENG%C4%B0_GR%C4%B0","outdoor_sporlar","Quechua","1590","4.5","1","Kullanılan süre 1 hafta ya da daha az tarihinden beri","Dar bir kalip rahat bir ayakkabi degil. On tarafi parmaklari sıkıyor. Tavsiye etmiyorum.",""
"14","https://www.decathlon.com.tr/r/kadin-outdoor-bot-gri-nh100/_/R-p-171860?mc=8649282&c=KAHVERENG%C4%B0_GR%C4%B0","outdoor_sporlar","Quechua","1590","4.5","5","Kullanılan süre 3 ile 6 ay arası tarihinden beri","Çocuğum uzun süre kullandı. Çok memnun kaldık.",""
"14","https://www.decathlon.com.tr/r/kadin-outdoor-bot-gri-nh100/_/R-p-171860?mc=8649282&c=KAHVERENG%C4%B0_GR%C4%B0","outdoor_sporlar","Quechua","1590","4.5","5","Kullanılan süre 2 ile 8 hafta arası tarihinden beri","2 kere dağ yürüyüşüne gittim. Biri 10 km diğeri 16 km tırmanış içeren zor bir parkurdu. Ayağım kaç farklı açıyla bastı bilmiyorum ama hiç burkulma yaşamadım bileği kavrıyor ve koruyor.",""
"14","https://www.decathlon.com.tr/r/kadin-outdoor-bot-gri-nh100/_/R-p-171860?mc=8649282&c=KAHVERENG%C4%B0_GR%C4%B0","outdoor_sporlar","Quechua","1590","4.5","5","Kullanılan süre 3 ile 6 ay arası tarihinden beri","yıllardır arazide giyiyorum ve sürekli yıkıyorum. inanılmaz sağlam. sadece su geçirmezliği yok.",""
"14","https://www.decathlon.com.tr/r/kadin-outdoor-bot-gri-nh100/_/R-p-171860?mc=8649282&c=KAHVERENG%C4%B0_GR%C4%B0","outdoor_sporlar","Quechua","1590","4.5","1","Kullanılan süre 1 hafta ya da daha az tarihinden beri","Tavsiye etmiyorum mağazanın kapanmasına on dk kala acele ile aldım mağaza görevlisi yüzünden sadece 1 kez giydim çok kötüydü kağıt gibi zaten tırnakları çok itiyor",""
"14","https://www.decathlon.com.tr/r/kadin-outdoor-bot-gri-nh100/_/R-p-171860?mc=8649282&c=KAHVERENG%C4%B0_GR%C4%B0","outdoor_sporlar","Quechua","1590","4.5","5","Kullanılan süre 3 ile 6 ay arası tarihinden beri","Ürünü uzun süredir kullanıyorum, gerçekten çok memnunum. Sürekli arazi gezlerinde ve kamp vs gibi etkinliklerinde kullandım gerçekten sağlam ve sıcak tutuyor. Ama su geçirmez değil. Düşünmeden alabilirsiniz.",""
"14","https://www.decathlon.com.tr/r/kadin-outdoor-bot-gri-nh100/_/R-p-171860?mc=8649282&c=KAHVERENG%C4%B0_GR%C4%B0","outdoor_sporlar","Quechua","1590","4.5","5","Kullanılan süre 2 ile 8 hafta arası tarihinden beri","Bunun siyah versiyonunu almıştım sonra kayboldu. O yüzden şehirde giymek için bunu aldım. Bot olması ve rahat olması sebebiyle seviyorum. Ayak numaram uygun olduğu için kadın reyonundan da giyiniyorum. Çünkü kadınların renk seçimi erkeklerinkine göre çok daha güzel. Erkeklere de renk seçenekleri gelsin..",""
"14","https://www.decathlon.com.tr/r/kadin-outdoor-bot-gri-nh100/_/R-p-171860?mc=8649282&c=KAHVERENG%C4%B0_GR%C4%B0","outdoor_sporlar","Quechua","1590","4.5","4","Kullanılan süre 2 ile 8 hafta arası tarihinden beri","Beğendim",""
"14","https://www.decathlon.com.tr/r/kadin-outdoor-bot-gri-nh100/_/R-p-171860?mc=8649282&c=KAHVERENG%C4%B0_GR%C4%B0","outdoor_sporlar","Quechua","1590","4.5","4","Kullanılan süre 2 ile 8 hafta arası tarihinden beri","İyi",""
"14","https://www.decathlon.com.tr/r/kadin-outdoor-bot-gri-nh100/_/R-p-171860?mc=8649282&c=KAHVERENG%C4%B0_GR%C4%B0","outdoor_sporlar","Quechua","1590","4.5","5","Kullanılan süre 3 ile 6 ay arası tarihinden beri","Güzel",""
"14","https://www.decathlon.com.tr/r/kadin-outdoor-bot-gri-nh100/_/R-p-171860?mc=8649282&c=KAHVERENG%C4%B0_GR%C4%B0","outdoor_sporlar","Quechua","1590","4.5","4","Kullanılan süre 3 ile 6 ay arası tarihinden beri","Bilek destekli olmasına rağmen giyip çıkarması kolay, genellikle amatör doğa yürüyüşleri yaptığımdan benim için tam bir fiyat performans ürünü oldu, hatta bazen gün içinde ayaklarımın rahat etmesini istediğimde de giyiyorum.",""
"14","https://www.decathlon.com.tr/r/kadin-outdoor-bot-gri-nh100/_/R-p-171860?mc=8649282&c=KAHVERENG%C4%B0_GR%C4%B0","outdoor_sporlar","Quechua","1590","4.5","2","","baya kötü. bütün taşları hissediyorsunuz",""
"14","https://www.decathlon.com.tr/r/kadin-outdoor-bot-gri-nh100/_/R-p-171860?mc=8649282&c=KAHVERENG%C4%B0_GR%C4%B0","outdoor_sporlar","Quechua","1590","4.5","5","Kullanılan süre 2 yıldan daha fazla tarihinden beri","rahat ve kullanışlı",""
"14","https://www.decathlon.com.tr/r/kadin-outdoor-bot-gri-nh100/_/R-p-171860?mc=8649282&c=KAHVERENG%C4%B0_GR%C4%B0","outdoor_sporlar","Quechua","1590","4.5","5","Kullanılan süre 7 ile 12 ay arası tarihinden beri","1 beden büyük alın",""
"14","https://www.decathlon.com.tr/r/kadin-outdoor-bot-gri-nh100/_/R-p-171860?mc=8649282&c=KAHVERENG%C4%B0_GR%C4%B0","outdoor_sporlar","Quechua","1590","4.5","5","Kullanılan süre 1 hafta ya da daha az tarihinden beri","başarılı bir ürün dechatlon dan başka bir yerden ürün almam",""
"14","https://www.decathlon.com.tr/r/kadin-outdoor-bot-gri-nh100/_/R-p-171860?mc=8649282&c=KAHVERENG%C4%B0_GR%C4%B0","outdoor_sporlar","Quechua","1590","4.5","5","Kullanılan süre 3 ile 6 ay arası tarihinden beri","Suya batmazsa hafif yağmurda su geçirmiyor. Bir numara büyük almak lazım. Kaliteli ve darbelere dayanıklı bir ürün.",""
"14","https://www.decathlon.com.tr/r/kadin-outdoor-bot-gri-nh100/_/R-p-171860?mc=8649282&c=KAHVERENG%C4%B0_GR%C4%B0","outdoor_sporlar","Quechua","1590","4.5","5","Kullanılan süre 3 ile 6 ay arası tarihinden beri","fiyat performans ürünü tavsiye ederim",""
"14","https://www.decathlon.com.tr/r/kadin-outdoor-bot-gri-nh100/_/R-p-171860?mc=8649282&c=KAHVERENG%C4%B0_GR%C4%B0","outdoor_sporlar","Quechua","1590","4.5","3","Kullanılan süre 1 hafta ya da daha az tarihinden beri","38 giymeme rağmen botta darlığı geçtim, uzunluktada sıkıntı var. Sanki 37 almışım gibi. Ayrıca iki ürünün yüzeyi farklı imiş yeni farkediyorum. Ürün değişimine gidicem.",""
"14","https://www.decathlon.com.tr/r/kadin-outdoor-bot-gri-nh100/_/R-p-171860?mc=8649282&c=KAHVERENG%C4%B0_GR%C4%B0","outdoor_sporlar","Quechua","1590","4.5","5","Kullanılan süre 1 yıldan daha fazla tarihinden beri","2 yıldır severek giyiyorum çok memnunum
Tam bedeninizi alabilirsiniz.
Su geçirmezlik yok su geçiyor.
Ama ısıtma kavrama şıklık her yönüyle beğeniyorum",""
"14","https://www.decathlon.com.tr/r/kadin-outdoor-bot-gri-nh100/_/R-p-171860?mc=8649282&c=KAHVERENG%C4%B0_GR%C4%B0","outdoor_sporlar","Quechua","1590","4.5","5","Kullanılan süre 2 ile 8 hafta arası tarihinden beri","tam bir fiyat performans ürünü harika",""
"14","https://www.decathlon.com.tr/r/kadin-outdoor-bot-gri-nh100/_/R-p-171860?mc=8649282&c=KAHVERENG%C4%B0_GR%C4%B0","outdoor_sporlar","Quechua","1590","4.5","4","","kardeşime almıştım çok memnun kaldı",""
"14","https://www.decathlon.com.tr/r/kadin-outdoor-bot-gri-nh100/_/R-p-171860?mc=8649282&c=KAHVERENG%C4%B0_GR%C4%B0","outdoor_sporlar","Quechua","1590","4.5","5","Kullanılan süre 3 ile 6 ay arası tarihinden beri","mükemmel",""
"14","https://www.decathlon.com.tr/r/kadin-outdoor-bot-gri-nh100/_/R-p-171860?mc=8649282&c=KAHVERENG%C4%B0_GR%C4%B0","outdoor_sporlar","Quechua","1590","4.5","5","Kullanılan süre 1 hafta ya da daha az tarihinden beri","Ürün tam fiyat performans ürünü gerçekten hakediyor",""
"14","https://www.decathlon.com.tr/r/kadin-outdoor-bot-gri-nh100/_/R-p-171860?mc=8649282&c=KAHVERENG%C4%B0_GR%C4%B0","outdoor_sporlar","Quechua","1590","4.5","3","Kullanılan süre 1 yıldan daha fazla tarihinden beri","Alt seviye bir ürün. Fiyatına göre uygun. Ancak uzun kullanımda ve doğa yürüyüşlerinde yorabilir.",""
"14","https://www.decathlon.com.tr/r/kadin-outdoor-bot-gri-nh100/_/R-p-171860?mc=8649282&c=KAHVERENG%C4%B0_GR%C4%B0","outdoor_sporlar","Quechua","1590","4.5","4","Kullanılan süre 3 ile 6 ay arası tarihinden beri","Rahat",""
"14","https://www.decathlon.com.tr/r/kadin-outdoor-bot-gri-nh100/_/R-p-171860?mc=8649282&c=KAHVERENG%C4%B0_GR%C4%B0","outdoor_sporlar","Quechua","1590","4.5","5","Kullanılan süre 2 yıldan daha fazla tarihinden beri","Ürün tanıtımında belirtilen limitlerinin çok üstünde kullanılmasına rağmen problem yaşatmadı.",""
"14","https://www.decathlon.com.tr/r/kadin-outdoor-bot-gri-nh100/_/R-p-171860?mc=8649282&c=KAHVERENG%C4%B0_GR%C4%B0","outdoor_sporlar","Quechua","1590","4.5","5","Kullanılan süre 2 yıldan daha fazla tarihinden beri","kesinlikle fiyat performans açısından çok iyi",""
"14","https://www.decathlon.com.tr/r/kadin-outdoor-bot-gri-nh100/_/R-p-171860?mc=8649282&c=KAHVERENG%C4%B0_GR%C4%B0","outdoor_sporlar","Quechua","1590","4.5","5","Kullanılan süre 7 ile 12 ay arası tarihinden beri","eşim kisa mesafelerde kullanıyor. gayet güzel ve rahatmış. ayağın içindeki hissiyatidan memnun.",""
"14","https://www.decathlon.com.tr/r/kadin-outdoor-bot-gri-nh100/_/R-p-171860?mc=8649282&c=KAHVERENG%C4%B0_GR%C4%B0","outdoor_sporlar","Quechua","1590","4.5","4","Kullanılan süre 1 hafta ya da daha az tarihinden beri","Kısa mesafeli yürüyüşler için ideal",""
"14","https://www.decathlon.com.tr/r/kadin-outdoor-bot-gri-nh100/_/R-p-171860?mc=8649282&c=KAHVERENG%C4%B0_GR%C4%B0","outdoor_sporlar","Quechua","1590","4.5","5","Kullanılan süre 2 ile 8 hafta arası tarihinden beri","Harika bir ayakkabı. Doğa yürüyüşlerinde kullanıyorum.",""
"14","https://www.decathlon.com.tr/r/kadin-outdoor-bot-gri-nh100/_/R-p-171860?mc=8649282&c=KAHVERENG%C4%B0_GR%C4%B0","outdoor_sporlar","Quechua","1590","4.5","5","Kullanılan süre 1 hafta ya da daha az tarihinden beri","Tam ayağıma göre",""
"14","https://www.decathlon.com.tr/r/kadin-outdoor-bot-gri-nh100/_/R-p-171860?mc=8649282&c=KAHVERENG%C4%B0_GR%C4%B0","outdoor_sporlar","Quechua","1590","4.5","5","Kullanılan süre 2 yıldan daha fazla tarihinden beri","oldukça kaliteli ve dayanıklı bir ürün",""
"14","https://www.decathlon.com.tr/r/kadin-outdoor-bot-gri-nh100/_/R-p-171860?mc=8649282&c=KAHVERENG%C4%B0_GR%C4%B0","outdoor_sporlar","Quechua","1590","4.5","5","Kullanılan süre 2 ile 8 hafta arası tarihinden beri","fiyatına göre güzel bir ayakkabı bence ideal bir başlangıç sağlıyor. Kaıbı çok dar normalde 38 giyerken 40 numara ancak oldu ayağıma",""
"14","https://www.decathlon.com.tr/r/kadin-outdoor-bot-gri-nh100/_/R-p-171860?mc=8649282&c=KAHVERENG%C4%B0_GR%C4%B0","outdoor_sporlar","Quechua","1590","4.5","3","Kullanılan süre 3 ile 6 ay arası tarihinden beri","Kullanışlı değil",""
"14","https://www.decathlon.com.tr/r/kadin-outdoor-bot-gri-nh100/_/R-p-171860?mc=8649282&c=KAHVERENG%C4%B0_GR%C4%B0","outdoor_sporlar","Quechua","1590","4.5","5","Kullanılan süre 1 hafta ya da daha az tarihinden beri","eşim için almıştım kalıbı küçük olduğu için 1 beden büyük aldım bilginiz olsun",""
"14","https://www.decathlon.com.tr/r/kadin-outdoor-bot-gri-nh100/_/R-p-171860?mc=8649282&c=KAHVERENG%C4%B0_GR%C4%B0","outdoor_sporlar","Quechua","1590","4.5","5","Kullanılan süre 2 yıldan daha fazla tarihinden beri","çok iyi",""
"14","https://www.decathlon.com.tr/r/kadin-outdoor-bot-gri-nh100/_/R-p-171860?mc=8649282&c=KAHVERENG%C4%B0_GR%C4%B0","outdoor_sporlar","Quechua","1590","4.5","5","Kullanılan süre 2 ile 8 hafta arası tarihinden beri","Tam bedenimi aldım 38 gayet iyi decathlon kalitesi",""
"14","https://www.decathlon.com.tr/r/kadin-outdoor-bot-gri-nh100/_/R-p-171860?mc=8649282&c=KAHVERENG%C4%B0_GR%C4%B0","outdoor_sporlar","Quechua","1590","4.5","1","Kullanılan süre 1 hafta ya da daha az tarihinden beri","Bugün gitmiş olduğum dağ tırmanışlı bir yürüyüşte denedim kendisini.Ancak zemini ayaklarımda çok hissettim yani tabanı ince.Parmaklarımı acıttı.Ve tabanı çok sert tamamen bir kabusa döndü yürüyüşüm :(",""
"14","https://www.decathlon.com.tr/r/kadin-outdoor-bot-gri-nh100/_/R-p-171860?mc=8649282&c=KAHVERENG%C4%B0_GR%C4%B0","outdoor_sporlar","Quechua","1590","4.5","4","Kullanılan süre 3 ile 6 ay arası tarihinden beri","Ayakkabıyı dağda , ıslak ve kayalık zeminde kullandım. Yer tutuşu çok iyi, ayağı kavraması güzel.Hafif yağmurda da giyilir. Fakat sağanak yağmurda su çekiyor. Bunu da firma zaten açıklıyor, kuru havalarda hobi amaçlı yürüyüş için diye. Ayak numaramızdan bir büyük numara alın. Su da almasa harika , kumaşı sağlam bir ürün.",""
"14","https://www.decathlon.com.tr/r/kadin-outdoor-bot-gri-nh100/_/R-p-171860?mc=8649282&c=KAHVERENG%C4%B0_GR%C4%B0","outdoor_sporlar","Quechua","1590","4.5","5","Kullanılan süre 3 ile 6 ay arası tarihinden beri","Güzel 👍🏼",""
"14","https://www.decathlon.com.tr/r/kadin-outdoor-bot-gri-nh100/_/R-p-171860?mc=8649282&c=KAHVERENG%C4%B0_GR%C4%B0","outdoor_sporlar","Quechua","1590","4.5","5","Kullanılan süre 2 ile 8 hafta arası tarihinden beri","Likya yolunu yürümek için aldım bu ayakkabıyı. İnsanların yorumları kayma vb korkutmuştu beni ama anladım ki insanlar outdoor ayakkabıyı şehirde gezmek için alıyor. Şimdiye kadar 100 km yürüdüm bu ayakkabıyla, ne kaydım ne düştüm ne de ayağım su topladı. Ama ben şöyle yaptım, bir numara büyük aldım ve küçük parmağımı yara bandı ile sardım. Yürüyüş boyunca tek bir gün sandalet giydim ve keen marka sandalet giydiğim gün ayak parmağımı vurdu sandalet. Geri bu ayakkabıya dönünce ayağım dinlendi :) harika bir fiyat performans ürünü. Ayrıca yağmurda kayalıklardan da geçtim ayağım kaymadı, hatta bi saat falan yağmurda yürüdüm ayağıma su geçmedi ama hafifçe ıslandı. O da çabuk kurudu zaten. Şuan yürümek için ben de başta 3-4 binlik ayakkabılara bakmıştım, ama gerek yok , daha ne yapabilir ki bi ayakkabı. Vurmadı, burkmadı ,incitmedi ama tekrar söylüyorum uzun yürüyüşler için minik parmaklarınızı ( ayak serçe parmağı) mutlaka yara bandı ile sarmalısıniz.",""
"14","https://www.decathlon.com.tr/r/kadin-outdoor-bot-gri-nh100/_/R-p-171860?mc=8649282&c=KAHVERENG%C4%B0_GR%C4%B0","outdoor_sporlar","Quechua","1590","4.5","5","Kullanılan süre 2 ile 8 hafta arası tarihinden beri","ayağı güzel kavrıyor ve muadillerine göre kalıtesi ve fiyatı tecih edilebilir",""
"14","https://www.decathlon.com.tr/r/kadin-outdoor-bot-gri-nh100/_/R-p-171860?mc=8649282&c=KAHVERENG%C4%B0_GR%C4%B0","outdoor_sporlar","Quechua","1590","4.5","5","Kullanılan süre 2 ile 8 hafta arası tarihinden beri","Muhteşem",""
"14","https://www.decathlon.com.tr/r/kadin-outdoor-bot-gri-nh100/_/R-p-171860?mc=8649282&c=KAHVERENG%C4%B0_GR%C4%B0","outdoor_sporlar","Quechua","1590","4.5","2","Kullanılan süre 2 ile 8 hafta arası tarihinden beri","Kalıbı dar , iç tabanı dümdüz dış tabanı ıslak zeminde kayıyor ve aşırı rahatsız uzun süre veya yürüyüşte giyilebilecek bir ayakkabı değil, indirimde görünce görüntüsüne aldanıp aldım fakat pişman oldum , iade süresini de kaçırdım kaldı elimde",""
