"URUN_NO","LINK_AD","SPOR_DALI","MARKA","FIYAT","TUM_YILDIZ","YORUM_YILDIZ","YORUM_KULLANIM_SURESI","YORUM","YORUMUN_POLARITESI"
"26","https://www.decathlon.com.tr/r/cocuk-krampon-futbol-ayakkabisi-mavi-viralto-i-easy-mg-ag/_/R-p-342999?mc=8917491&c=MAV%C4%B0","futbol","Kipsta","1890","4.8","5","Kullanılan süre 2 ile 8 hafta arası tarihinden beri","Yiğenime aldım severek kullanıyor görüntüsü falan çok iyi zaten",""
"26","https://www.decathlon.com.tr/r/cocuk-krampon-futbol-ayakkabisi-mavi-viralto-i-easy-mg-ag/_/R-p-342999?mc=8917491&c=MAV%C4%B0","futbol","Kipsta","1890","4.8","5","Kullanılan süre 2 ile 8 hafta arası tarihinden beri","Pratik ve rahat giyim sağlanıyor.",""
"26","https://www.decathlon.com.tr/r/cocuk-krampon-futbol-ayakkabisi-mavi-viralto-i-easy-mg-ag/_/R-p-342999?mc=8917491&c=MAV%C4%B0","futbol","Kipsta","1890","4.8","4","Kullanılan süre 2 ile 8 hafta arası tarihinden beri","Oğlum çok memnun. Brn de altındaki çivilerin aşırı sivri olmamasına sevindim. Toprak tutuşu iyi.",""
"26","https://www.decathlon.com.tr/r/cocuk-krampon-futbol-ayakkabisi-mavi-viralto-i-easy-mg-ag/_/R-p-342999?mc=8917491&c=MAV%C4%B0","futbol","Kipsta","1890","4.8","5","Kullanılan süre 2 ile 8 hafta arası tarihinden beri","ÇOCUĞUM ÇOK BEĞENDİ",""
"26","https://www.decathlon.com.tr/r/cocuk-krampon-futbol-ayakkabisi-mavi-viralto-i-easy-mg-ag/_/R-p-342999?mc=8917491&c=MAV%C4%B0","futbol","Kipsta","1890","4.8","5","Kullanılan süre 2 ile 8 hafta arası tarihinden beri","çok rahat , giy çık cocuklar için oldukca kullanışlı. oğlum daha oncede 4 tane kullandı aynı markadan cok memnun. sadece yanlardan biraz dar bir kalıp",""
"26","https://www.decathlon.com.tr/r/cocuk-krampon-futbol-ayakkabisi-mavi-viralto-i-easy-mg-ag/_/R-p-342999?mc=8917491&c=MAV%C4%B0","futbol","Kipsta","1890","4.8","5","Kullanılan süre 2 ile 8 hafta arası tarihinden beri","Rahat ve estetik bu 4. krampon seçimimiz buda bizi yanıltmadı oğlum cok memnun",""
"26","https://www.decathlon.com.tr/r/cocuk-krampon-futbol-ayakkabisi-mavi-viralto-i-easy-mg-ag/_/R-p-342999?mc=8917491&c=MAV%C4%B0","futbol","Kipsta","1890","4.8","5","Kullanılan süre 2 ile 8 hafta arası tarihinden beri","Oğlum için aldım zaten bütün kramponlarını Decathlon dan alıyorum hem sağlam ve dayanıklı hemde çok rahat ayak taban kısmında hic rahatsızlık yaşamadık çok memnunuz",""
"26","https://www.decathlon.com.tr/r/cocuk-krampon-futbol-ayakkabisi-mavi-viralto-i-easy-mg-ag/_/R-p-342999?mc=8917491&c=MAV%C4%B0","futbol","Kipsta","1890","4.8","5","Kullanılan süre 1 hafta ya da daha az tarihinden beri","Çocuğum severek kullanıyor.",""
"26","https://www.decathlon.com.tr/r/cocuk-krampon-futbol-ayakkabisi-mavi-viralto-i-easy-mg-ag/_/R-p-342999?mc=8917491&c=MAV%C4%B0","futbol","Kipsta","1890","4.8","5","Kullanılan süre 2 ile 8 hafta arası tarihinden beri","Bu çok kaliteli tavsiye ederim",""
"26","https://www.decathlon.com.tr/r/cocuk-krampon-futbol-ayakkabisi-mavi-viralto-i-easy-mg-ag/_/R-p-342999?mc=8917491&c=MAV%C4%B0","futbol","Kipsta","1890","4.8","5","Kullanılan süre 3 ile 6 ay arası tarihinden beri","çocuğum için aldım hem halısaha da hem çim sahada kullaniyor",""
"26","https://www.decathlon.com.tr/r/cocuk-krampon-futbol-ayakkabisi-mavi-viralto-i-easy-mg-ag/_/R-p-342999?mc=8917491&c=MAV%C4%B0","futbol","Kipsta","1890","4.8","2","Kullanılan süre 2 ile 8 hafta arası tarihinden beri","Umduğum gibi değil. Çocuğum 7 yaşında günde enfazla 1 saat oyun için sadece halı sahada giyiyor. Ayakkabının alt dişlerinde deformasyon çok hızlı ilerliyor. Bence kalitesiz. Bir dah kesinlikle tercih etmem",""
"26","https://www.decathlon.com.tr/r/cocuk-krampon-futbol-ayakkabisi-mavi-viralto-i-easy-mg-ag/_/R-p-342999?mc=8917491&c=MAV%C4%B0","futbol","Kipsta","1890","4.8","5","Kullanılan süre 1 hafta ya da daha az tarihinden beri","Güzel ürün. Rahat, kullanışlı.",""
"26","https://www.decathlon.com.tr/r/cocuk-krampon-futbol-ayakkabisi-mavi-viralto-i-easy-mg-ag/_/R-p-342999?mc=8917491&c=MAV%C4%B0","futbol","Kipsta","1890","4.8","5","Kullanılan süre 2 ile 8 hafta arası tarihinden beri","Süper",""
"26","https://www.decathlon.com.tr/r/cocuk-krampon-futbol-ayakkabisi-mavi-viralto-i-easy-mg-ag/_/R-p-342999?mc=8917491&c=MAV%C4%B0","futbol","Kipsta","1890","4.8","5","Kullanılan süre 2 ile 8 hafta arası tarihinden beri","Çocuk için ideal. Giyip çıkarması kolay.",""
"26","https://www.decathlon.com.tr/r/cocuk-krampon-futbol-ayakkabisi-mavi-viralto-i-easy-mg-ag/_/R-p-342999?mc=8917491&c=MAV%C4%B0","futbol","Kipsta","1890","4.8","5","Kullanılan süre 3 ile 6 ay arası tarihinden beri","Oğlum için aldım gayet memnun iyi vuruyor topa",""
"26","https://www.decathlon.com.tr/r/cocuk-krampon-futbol-ayakkabisi-mavi-viralto-i-easy-mg-ag/_/R-p-342999?mc=8917491&c=MAV%C4%B0","futbol","Kipsta","1890","4.8","3","Kullanılan süre 3 ile 6 ay arası tarihinden beri","Ayakkabıyı ogluma aldim kalitelidir diye ama istediğimiz kalitede değil acayip bir leke tutma potansiyeli var silmekten bıktık duruşu ve cirti çok iyi değil alalı 4 ay falan oldu sanirim iade etmeyi düşünüyorum Almayın derim daha kalitelidir bakın bi fiyata daha iyileri bulunabilir",""
"26","https://www.decathlon.com.tr/r/cocuk-krampon-futbol-ayakkabisi-mavi-viralto-i-easy-mg-ag/_/R-p-342999?mc=8917491&c=MAV%C4%B0","futbol","Kipsta","1890","4.8","5","Kullanılan süre 2 ile 8 hafta arası tarihinden beri","Şimdilik rahat biraz çocuğun ayağını sıkmış onun dışında bir problem yok. Teşekkür ederim",""
"26","https://www.decathlon.com.tr/r/cocuk-krampon-futbol-ayakkabisi-mavi-viralto-i-easy-mg-ag/_/R-p-342999?mc=8917491&c=MAV%C4%B0","futbol","Kipsta","1890","4.8","5","Kullanılan süre 1 hafta ya da daha az tarihinden beri","Oğlum çok istiyordu. Kendi beğendi rengini . Bedenini kendisi seçti. Doğum gününde ayağından çıkarmadı.",""
